{
    "Version": 2020.1,
    "Id": "6db11f97-0c2d-4444-beb9-574e10318d10",
    "Timestamp": "2019-12-20T10:20:06-0500",
    "POHeader": {
        "SoldTo": {
            "PartyId": "NAMM*000010298975",
            "PartyIdType": "NAMM",
            "Name": "Bill's Music",
            "Address": {
                "Attn": "Bill",
                "Address1": "1 Main St",
                "City": "New York",
                "State": "NY",
                "PostalCode": "11101",
                "Country": "USA",
                "CountryCode": "US"
            }
        },
        "BillTo": {
            "PartyId": "NAMM*000010298975",
            "PartyIdType": "NAMM",
            "Name": "Bill's Music",
            "Address": {
                "Address1": "1 Main St",
                "City": "New York",
                "State": "NY",
                "PostalCode": "11101",
                "Country": "USA",
                "CountryCode": "US"
            }
        },
        "BuyerOrderId": "65642X",
        "Supplier": {
            "PartyId": "0670716000009",
            "PartyIdType" : "GLN",
            "Name": "Korg USA, Inc.",
            "Address" : {}
        },
        "TermsCode": "P001",
        "TranspCode": "S013",
        "DateOrdered": "2019-12-20",
        "Backorder": "Y",
        "PORevisionNumber": 1,
        "POStatusIndicator": "N",
        "ASNRequirement": "Y",
        "POFileType": "P",
        "ShipInstructions": "Some Comment Here",
        "ShipTo": {
            "PartyId": "098765432123",
            "PartyIdType": "GLN",
            "Name": "Bill's Music",
            "Address": {
                "Address1": "1 Main St",
                "City": "New York",
                "State": "NY",
                "PostalCode": "11101"
            }
        }
    
    },
    "PODetail": {
        "Items": [            {
                "POLineNbr": 1,
                "BuyerItemId": "MAA207",
                "BuyerItemDesc": "Vox amPlug Twin Headphone Amp",
                "Qty": 1,
                "QtyUOM": "Each",
                "UCValue": 55.00,
                "UCCurrencyCode": "USD",
                "SupplierItemId": "APTW",
                "BarCodeId": "4959112088023",
                "BarCodeType": "GTIN-12"
            },
            {
                "POLineNbr": 2,
                "BuyerItemId": "MAA055",
                "BuyerItemDesc": "Vox AmPlug Headphone Guitar Amp, Classic Rock",
                "Qty": 1,
                "QtyUOM": "Each",
                "UCValue": 99.00,
                "UCCurrencyCode": "USD",
                "SupplierItemId": "APCR",
                "BarCodeId": "4959112057630",
                "BarCodeType": "GTIN-12",
                "TranspCode": "S020",
                "ShipTo": {
                    "Name": "Jack Smith",
                    "Address": {
                        "Address1": "101 Diana Dr",
                        "City": "Guyton",
                        "State": "GA",
                        "PostalCode": "31312"
                    }
                }
            }
        ]
}
}
